{"aggregate_checks":["fixture-receipt"],"assets":{},"assumptions":[],"baseline":{"base":"e7671c1efc6a124d33104ca84c210242d90e447d841ef5bc6203bafba2bff47c","build":"not-built","head":"e7671c1efc6a124d33104ca84c210242d90e447d841ef5bc6203bafba2bff47c","manifest":"a57b8e04cc450a725bfb5e2278b212e23a675a2445e9b455ef38932c0236e9c5"},"candidate":{"base":"e7671c1efc6a124d33104ca84c210242d90e447d841ef5bc6203bafba2bff47c","build":"not-built","head":"1e69356026ce19097694130deb4214bc1dc67f568d2322ea4b945ec2b64abd5b","manifest":"52c669c078d4cb4db756c155c19368843b859bbbc1e78a94da5d1399cecc67db"},"change":{"closure":{"complete":true,"fallback":null},"id":"CS-filter","impact":[{"classification":"direct","domain":"spec","node":"ac:US-16.AC-01","path":["ac:US-16.AC-01"],"reason":"exact source wording"}],"propagation":[{"ac":["US-16.AC-01"],"behavior":"Return exact saved selection","evidence":["fixture-receipt"],"review":"D1 contract-fixture review; product verification NOT RUN","scenario":["US-16.SCN-16-01"],"status":"verified","ui":["not-applicable: contract-only fixture; confirmed by po in D1"]}],"reason":"Clarify exact selection in contract fixture","rules":[{"after":"Return that exact saved selection","before":"Return saved selection","source":"D1"}],"source":"D1"},"decisions":[{"id":"D1","source":"decisions/decisions.md","text":"Preserve the saved selection exactly; no feature UI in this contract fixture"}],"evidence":[{"artifacts":{"decisions/decisions.md":"e795b0a20f6b0a73419f5a21db46417b25096ce501552226d934ce204d018e61"},"at":"2026-10-07T03:00:00Z","coverage":{"ac":["US-16.AC-01"],"na":[],"passed":["US-16.AC-01"],"scenarios":["US-16.SCN-16-01"]},"domain":"concept","execution":{"baseline_debt":[],"command":"fixture declared contract review (not executed product checks)","cwd":"evidence","exit":0,"recovery":"Fixture only; real product gates require executed evidence","red_controls":["stale-pins","unknown-scope","digest-mismatch"],"result":"PASS","selected":1,"skipped":[],"total":1},"freshness":"CURRENT","id":"fixture-receipt","pins":{"artifact":"1e69356026ce19097694130deb4214bc1dc67f568d2322ea4b945ec2b64abd5b","build":"not-built","context":"1e69356026ce19097694130deb4214bc1dc67f568d2322ea4b945ec2b64abd5b","evaluator":"fixture-1","prompt":"fixture-1","rules":"fixture-1","scenario":"fixture-1","source":"e795b0a20f6b0a73419f5a21db46417b25096ce501552226d934ce204d018e61"},"review":{"builder":"dev","criteria":[{"evidence":"D1","id":"source","mandatory":true,"score":2}],"evaluator_version":"fixture-1","findings":[],"independent":true,"inputs":["us/US-16.md","decisions/decisions.md"],"prompt_version":"fixture-1","reviewer":"qc","ruleset_version":"fixture-1","verdict":"PASS"},"scope":{"ids":["US-16.AC-01"],"kind":"ac","revision":"a84645d61daea3988dcb2a2c65a3ccedd8f1a94073e020dbc020b37e28dd2f03"}}],"exceptions":[],"findings":[],"membership":{"members":[{"artifacts":{"decisions/decisions.md":"e795b0a20f6b0a73419f5a21db46417b25096ce501552226d934ce204d018e61","us/US-16.md":"1e69356026ce19097694130deb4214bc1dc67f568d2322ea4b945ec2b64abd5b"},"id":"US-16.AC-01","kind":"ac","revision":"7d75aabe42efdbcf07e08680beb2e5a70c0a6c383242fa6a190d9f24da34dece"}],"version":"1"},"open":[],"product":"PRODUCT:OS Spec Driven","requests":[{"id":"US-16.AC-01","reason":"Review exact fixture wording"}],"scope":{"ids":["US-16.AC-01"],"kind":"ac","revision":"a84645d61daea3988dcb2a2c65a3ccedd8f1a94073e020dbc020b37e28dd2f03"},"screens":[],"unaffected":[],"version":"1"}